{
  "schemaVersion": "codex-chef.install-plan.v1",
  "description": "Codex-only install surface used for dry-run planning, validation, and collision review.",
  "profiles": {
    "default": [
      "codex-agents-md",
      "codex-config",
      "codex-rules",
      "codex-agents",
      "codex-profiles",
      "codex-plugin",
      "codex-plugin-marketplace-source",
      "codex-chef-operator-direct-skill",
      "context-budget-planner-direct-skill",
      "adaptive-agent-routing-direct-skill",
      "codex-chef-brain-direct-skill",
      "external-review-workflow-direct-skill",
      "fetch-direct-skill",
      "seo-direct-skill",
      "evidence-research-direct-skill",
      "offline-diagram-triplet-direct-skill",
      "plugin-marketplace"
    ],
    "all": [
      "codex-agents-md",
      "codex-config",
      "codex-rules",
      "codex-agents",
      "codex-profiles",
      "codex-plugin",
      "codex-plugin-marketplace-source",
      "codex-chef-operator-direct-skill",
      "context-budget-planner-direct-skill",
      "adaptive-agent-routing-direct-skill",
      "codex-chef-brain-direct-skill",
      "external-review-workflow-direct-skill",
      "fetch-direct-skill",
      "seo-direct-skill",
      "evidence-research-direct-skill",
      "offline-diagram-triplet-direct-skill",
      "plugin-marketplace",
      "curated-skills"
    ]
  },
  "operations": [
    {
      "id": "codex-agents-md",
      "kind": "copy-file",
      "summary": "Install durable global Codex guidance.",
      "source": "templates/codex/AGENTS.md",
      "destination": "${CODEX_HOME}/AGENTS.md",
      "platforms": ["windows", "unix"],
      "collision": "skip-unless-force-backup-before-replace",
      "backup": true,
      "risk": "medium",
      "conflictPolicy": "Global guidance can affect every repo. External repos keep precedence through repo-local AGENTS.md files."
    },
    {
      "id": "codex-config",
      "kind": "copy-file",
      "summary": "Install Codex config template for the current platform.",
      "sourceByPlatform": {
        "windows": "templates/codex/config.windows.toml",
        "unix": "templates/codex/config.unix.toml"
      },
      "destination": "${CODEX_HOME}/config.toml",
      "platforms": ["windows", "unix"],
      "collision": "merge-missing-blocks-unless-force-backup-before-replace",
      "backup": true,
      "risk": "medium",
      "conflictPolicy": "Canonical template plus user-owned overlay: existing model, profile, approval, sandbox, project trust, and unrelated MCP values are preserved outside Force. Codex Chef-managed agent/MCP safety tables are synchronized explicitly; Force replaces the file only after backup."
    },
    {
      "id": "codex-rules",
      "kind": "copy-file",
      "summary": "Install conservative default command-approval rules.",
      "source": "templates/codex/rules/default.rules",
      "destination": "${CODEX_HOME}/rules/default.rules",
      "platforms": ["windows", "unix"],
      "collision": "skip-unless-force-backup-before-replace",
      "backup": true,
      "risk": "medium",
      "conflictPolicy": "Rules allow narrow verification commands and keep destructive/publish actions approval-gated."
    },
    {
      "id": "codex-agents",
      "kind": "copy-glob",
      "summary": "Install specialist subagent definitions.",
      "sourceGlob": "templates/codex/agents/*.toml",
      "destinationDir": "${CODEX_HOME}/agents",
      "platforms": ["windows", "unix"],
      "collision": "skip-unless-force-backup-before-replace",
      "backup": true,
      "risk": "medium",
      "conflictPolicy": "Specialists stay narrow; do not import external repo-specific agent fleets into global defaults."
    },
    {
      "id": "codex-profiles",
      "kind": "copy-glob",
      "summary": "Install named Codex profile files.",
      "sourceGlob": "templates/codex/profiles/*.toml",
      "destinationDir": "${CODEX_HOME}",
      "platforms": ["windows", "unix"],
      "collision": "skip-unless-force-backup-before-replace",
      "backup": true,
      "risk": "medium",
      "conflictPolicy": "Profiles stay separate files and avoid mixing beta permission profiles with legacy sandbox settings."
    },
    {
      "id": "codex-plugin",
      "kind": "copy-directory",
      "summary": "Install the local workflow plugin bundle.",
      "source": "plugins/codex-chef-workflows",
      "destination": "${CODEX_HOME}/plugins/codex-chef-workflows",
      "platforms": ["windows", "unix"],
      "collision": "sync-managed-files-preserve-extras-backup-before-sync",
      "backup": true,
      "risk": "medium",
      "conflictPolicy": "Managed plugin files are refreshed after backup while extra files are preserved by default; destructive pruning requires an explicit repair flag."
    },
    {
      "id": "codex-chef-operator-direct-skill",
      "kind": "copy-directory",
      "summary": "Install the Codex Chef operator workflow for direct routing-profile invocation.",
      "source": "plugins/codex-chef-workflows/skills/codex-chef-operator",
      "destination": "${AGENTS_HOME}/skills/codex-chef-operator",
      "platforms": ["windows", "unix"],
      "collision": "sync-only-when-owned-or-exact-legacy-match-explicit-adoption-required-otherwise",
      "backup": true,
      "risk": "medium",
      "conflictPolicy": "The operator skill is synchronized from the canonical plugin source only when the target is absent, marked as Codex Chef-managed, or an exact legacy match. A foreign collision fails before any write unless that exact target is explicitly adopted."
    },
    {
      "id": "context-budget-planner-direct-skill",
      "kind": "copy-directory",
      "summary": "Install the context budget planner required by the global operating contract.",
      "source": "plugins/codex-chef-workflows/skills/context-budget-planner",
      "destination": "${AGENTS_HOME}/skills/context-budget-planner",
      "platforms": ["windows", "unix"],
      "collision": "sync-only-when-owned-or-exact-legacy-match-explicit-adoption-required-otherwise",
      "backup": true,
      "risk": "medium",
      "conflictPolicy": "The context planner is synchronized from the canonical plugin source only when the target is absent, marked as Codex Chef-managed, or an exact legacy match. A foreign collision fails before any write unless that exact target is explicitly adopted."
    },
    {
      "id": "adaptive-agent-routing-direct-skill",
      "kind": "copy-directory",
      "summary": "Install the adaptive routing workflow required by the global operating contract.",
      "source": "plugins/codex-chef-workflows/skills/adaptive-agent-routing",
      "destination": "${AGENTS_HOME}/skills/adaptive-agent-routing",
      "platforms": ["windows", "unix"],
      "collision": "sync-only-when-owned-or-exact-legacy-match-explicit-adoption-required-otherwise",
      "backup": true,
      "risk": "medium",
      "conflictPolicy": "The routing skill is synchronized from the canonical plugin source only when the target is absent, marked as Codex Chef-managed, or an exact legacy match. A foreign collision fails before any write unless that exact target is explicitly adopted."
    },
    {
      "id": "codex-chef-brain-direct-skill",
      "kind": "copy-directory",
      "summary": "Install the local Markdown Brain workflow for direct invocation.",
      "source": "plugins/codex-chef-workflows/skills/codex-chef-brain",
      "destination": "${AGENTS_HOME}/skills/codex-chef-brain",
      "platforms": ["windows", "unix"],
      "collision": "sync-only-when-owned-or-exact-legacy-match-explicit-adoption-required-otherwise",
      "backup": true,
      "risk": "medium",
      "conflictPolicy": "The Brain workflow is synchronized from the canonical plugin source only when the target is absent, marked as Codex Chef-managed, or an exact legacy match. A foreign collision fails before any write unless that exact target is explicitly adopted."
    },
    {
      "id": "external-review-workflow-direct-skill",
      "kind": "copy-directory",
      "summary": "Install the secret-safe external review workflow for direct invocation.",
      "source": "plugins/codex-chef-workflows/skills/external-review-workflow",
      "destination": "${AGENTS_HOME}/skills/external-review-workflow",
      "platforms": ["windows", "unix"],
      "collision": "sync-only-when-owned-or-exact-legacy-match-explicit-adoption-required-otherwise",
      "backup": true,
      "risk": "medium",
      "conflictPolicy": "The external review workflow is synchronized from the canonical plugin source only when the target is absent, marked as Codex Chef-managed, or an exact legacy match. A foreign collision fails before any write unless that exact target is explicitly adopted."
    },
    {
      "id": "fetch-direct-skill",
      "kind": "copy-directory",
      "summary": "Install the explicit-only Fetch workflow for direct $fetch invocation.",
      "source": "plugins/codex-chef-workflows/skills/fetch",
      "destination": "${AGENTS_HOME}/skills/fetch",
      "platforms": ["windows", "unix"],
      "collision": "sync-only-when-owned-or-exact-legacy-match-explicit-adoption-required-otherwise",
      "backup": true,
      "risk": "medium",
      "conflictPolicy": "The direct skill is synchronized from the same canonical source as the plugin-bundled version only when the target is absent, marked as Codex Chef-managed, or an exact legacy match. A foreign collision fails before any write unless the exact target is explicitly adopted; implicit invocation remains disabled."
    },
    {
      "id": "seo-direct-skill",
      "kind": "copy-directory",
      "summary": "Install the evidence-backed SEO workflow for direct $seo invocation.",
      "source": "plugins/codex-chef-workflows/skills/seo",
      "destination": "${AGENTS_HOME}/skills/seo",
      "platforms": ["windows", "unix"],
      "collision": "sync-only-when-owned-or-exact-legacy-match-explicit-adoption-required-otherwise",